{
  "settings": {
    "//artistEmail": "latelierdepatrouchka@yahoo.com",
    "artistEmail": "bgc77160@gmail.com",
    "adminEmails": [],
    "socialLinks": [],
    "address": {
      "fr": "Marchainville (61)",
      "en": "Marchainville (61), France"
    },
    "mapUrl": "https://maps.google.com/?q=Marchainville+61110+France"
  },
  "categories": [
    {
      "id": "crochet",
      "name": {
        "fr": "Crochet",
        "en": "Crochet"
      },
      "description": {
        "fr": "Créations au crochet et amigurumis.",
        "en": "Crochet creations and amigurumi."
      },
      "tags": [
        "crochet"
      ],
      "children": [
        {
          "id": "amigurumi",
          "name": {
            "fr": "Amigurumis",
            "en": "Amigurumi"
          },
          "tags": [
            "amigurumi"
          ]
        },
        {
          "id": "clothing",
          "name": {
            "fr": "Bonnets et accessoires crochet",
            "en": "Crochet hats and accessories"
          },
          "tags": [
            "clothing"
          ]
        }
      ]
    },
    {
      "id": "baby",
      "name": {
        "fr": "Bébé",
        "en": "Baby"
      },
      "description": {
        "fr": "Gâteaux de couches, hochets, doudous et attaches tétine.",
        "en": "Diaper cakes, rattles, comforters, and pacifier clips."
      },
      "tags": [
        "baby"
      ],
      "children": [
        {
          "id": "diaper-cakes",
          "name": {
            "fr": "Gâteaux de couches",
            "en": "Diaper cakes"
          },
          "tags": [
            "diaper-cake"
          ]
        },
        {
          "id": "rattle",
          "name": {
            "fr": "Hochets",
            "en": "Rattles"
          },
          "tags": [
            "rattle"
          ]
        },
        {
          "id": "pacifier-clip",
          "name": {
            "fr": "Attaches tétine",
            "en": "Pacifier clips"
          },
          "tags": [
            "pacifier-clip"
          ]
        }
      ]
    },
    {
      "id": "jewellery",
      "name": {
        "fr": "Bijoux",
        "en": "Jewellery"
      },
      "description": {
        "fr": "Boucles d'oreilles et bijoux faits main.",
        "en": "Handmade earrings and jewellery."
      },
      "tags": [
        "jewellery"
      ]
    },
    {
      "id": "resin",
      "name": {
        "fr": "Résine",
        "en": "Resin"
      },
      "description": {
        "fr": "Bijoux et décorations en résine",
        "en": "Handmade earrings and jewellery."
      },
      "tags": [
        "resin"
      ]
    },
    {
      "id": "decoration",
      "name": {
        "fr": "Décoration",
        "en": "Decoration"
      },
      "description": {
        "fr": "Décorations saisonnières, attrape-rêves et supports muraux.",
        "en": "Seasonal decorations, dreamcatchers, and wall hangings."
      },
      "tags": [
        "decoration"
      ],
      "children": [
        {
          "id": "christmas",
          "name": {
            "fr": "Noël",
            "en": "Christmas"
          },
          "tags": [
            "christmas"
          ]
        },
        {
          "id": "halloween",
          "name": {
            "fr": "Halloween",
            "en": "Halloween"
          },
          "tags": [
            "halloween"
          ]
        },
        {
          "id": "dreamcatcher",
          "name": {
            "fr": "Attrape-rêves",
            "en": "Dreamcatchers"
          },
          "tags": [
            "dreamcatcher"
          ]
        },
        {
          "id": "suncatcher",
          "name": {
            "fr": "Attrape-soleil",
            "en": "Suncatchers"
          },
          "tags": [
            "suncatcher"
          ]
        },
        {
          "id": "wall-hanging",
          "name": {
            "fr": "Suspension Murale",
            "en": "Wall hanging"
          },
          "tags": [
            "wall-hanging"
          ]
        }
      ]
    },
    {
      "id": "accessory",
      "name": {
        "fr": "Accessoires",
        "en": "Accessories"
      },
      "description": {
        "fr": "Sacs, paniers, porte-clés, chouchous et objets du quotidien.",
        "en": "Bags, baskets, keychains, hair ties, and everyday objects."
      },
      "tags": [
        "accessory"
      ],
      "children": [
        {
          "id": "bag",
          "name": {
            "fr": "Sacs et paniers",
            "en": "Bags and basket"
          },
          "tags": [
            "bag",
            "basket"
          ]
        },
        {
          "id": "keychain",
          "name": {
            "fr": "Porte clés",
            "en": "Keychain"
          },
          "tags": [
            "keychain"
          ]
        }
      ]
    }
  ],
  "items": [
    {
      "id": "ami-araignee-bleu",
      "available": true,
      "price": 0,
      "title": {
        "fr": "Amigurumi araignée bleu"
      },
      "tags": [
        "amigurumi",
        "crochet",
        "animal"
      ],
      "characteristics": {
        "colors": [
          "blue"
        ]
      }
    },
    {
      "id": "ami-bonhomme-neige",
      "title": {
        "fr": "Amigurumi bonhomme neige"
      },
      "price": 0,
      "tags": [
        "amigurumi",
        "crochet",
        "decoration",
        "christmas"
      ],
      "characteristics": {
        "colors": [
          "black",
          "white"
        ]
      },
      "available": true
    },
    {
      "id": "ami-bonhomme-neige-bonnet",
      "title": {
        "fr": "Amigurumi bonhomme neige bonnet"
      },
      "price": 0,
      "tags": [
        "amigurumi",
        "crochet",
        "decoration",
        "christmas"
      ],
      "characteristics": {
        "colors": [
          "blue",
          "white"
        ]
      },
      "available": true
    },
    {
      "id": "ami-bonhomme-pain-epice",
      "title": {
        "fr": "Amigurumi bonhomme pain épice"
      },
      "price": 0,
      "tags": [
        "amigurumi",
        "crochet"
      ],
      "available": true
    },
    {
      "id": "ami-enveloppe",
      "title": {
        "fr": "Amigurumi enveloppe"
      },
      "price": 0,
      "tags": [
        "amigurumi",
        "crochet"
      ],
      "available": true
    },
    {
      "id": "ami-etoile-bleu",
      "title": {
        "fr": "Amigurumi étoile bleu"
      },
      "price": 0,
      "tags": [
        "amigurumi",
        "crochet"
      ],
      "available": true
    },
    {
      "id": "ami-etoile-rouge",
      "title": {
        "fr": "Amigurumi étoile rouge"
      },
      "price": 0,
      "tags": [
        "amigurumi",
        "crochet"
      ],
      "available": true
    },
    {
      "id": "ami-golem",
      "title": {
        "fr": "Amigurumi golem"
      },
      "price": 0,
      "tags": [
        "amigurumi",
        "crochet"
      ],
      "available": true
    },
    {
      "id": "ami-groot",
      "title": {
        "fr": "Amigurumi groot"
      },
      "price": 0,
      "tags": [
        "amigurumi",
        "crochet"
      ],
      "available": true
    },
    {
      "id": "ami-lapin-bleu",
      "title": {
        "fr": "Amigurumi lapin bleu"
      },
      "price": 0,
      "tags": [
        "amigurumi",
        "crochet"
      ],
      "available": true
    },
    {
      "id": "ami-nain-blanc",
      "title": {
        "fr": "Amigurumi nain blanc"
      },
      "price": 0,
      "tags": [
        "amigurumi",
        "crochet"
      ],
      "available": true
    },
    {
      "id": "ami-nain-gris",
      "title": {
        "fr": "Amigurumi nain gris"
      },
      "price": 0,
      "tags": [
        "amigurumi",
        "crochet"
      ],
      "available": true
    },
    {
      "id": "ami-nain-rouge",
      "title": {
        "fr": "Amigurumi nain rouge"
      },
      "price": 0,
      "tags": [
        "amigurumi",
        "crochet"
      ],
      "available": true
    },
    {
      "id": "ami-pere-noel",
      "title": {
        "fr": "Amigurumi père noël"
      },
      "price": 0,
      "tags": [
        "amigurumi",
        "crochet"
      ],
      "available": true
    },
    {
      "id": "ami-poulpe-cyan",
      "title": {
        "fr": "Amigurumi poulpe cyan"
      },
      "price": 0,
      "tags": [
        "amigurumi",
        "crochet",
        "decoration",
        "scrunchy"
      ],
      "available": false
    },
    {
      "id": "ami-test-rouge-blanc",
      "title": {
        "fr": "Amigurumi test rouge blanc"
      },
      "price": 0,
      "tags": [
        "amigurumi",
        "crochet"
      ],
      "available": true
    },
    {
      "id": "ami-tete-bleu",
      "title": {
        "fr": "Amigurumi tête bleu"
      },
      "price": 0,
      "tags": [
        "amigurumi",
        "crochet"
      ],
      "available": true
    },
    {
      "id": "ami-tete-rouge",
      "title": {
        "fr": "Amigurumi tête rouge"
      },
      "price": 0,
      "tags": [
        "amigurumi",
        "crochet"
      ],
      "available": true
    },
    {
      "id": "ami-tete-rouge-blanc",
      "title": {
        "fr": "Amigurumi tête rouge blanc"
      },
      "price": 0,
      "tags": [
        "amigurumi",
        "crochet"
      ],
      "available": true
    },
    {
      "id": "ami-tete-rouge-blanc-rayure",
      "title": {
        "fr": "Amigurumi tête rouge blanc rayure"
      },
      "price": 0,
      "tags": [
        "amigurumi",
        "crochet"
      ],
      "available": true
    },
    {
      "id": "ami-poulpe-bleu",
      "title": {
        "fr": "Amigurumi poulpe bleu"
      },
      "price": 0,
      "tags": [
        "amigurumi",
        "crochet"
      ],
      "available": true
    },
    {
      "id": "ami-poulpe-fancy",
      "title": {
        "fr": "Amigurumi poulpe fancy"
      },
      "price": 0,
      "tags": [
        "amigurumi",